{
  "codec": "ymz280",
  "format": "adpcm",
  "sample_rate": 22050,
  "boundary": 256,
  "output_bin": "output/test_ymz280_adpcm.bin",
  "output_json": "output/test_ymz280_adpcm.json",
  "wav_files": [
    { "path": "test/wav/test_440hz_44100_mono.wav",   "name": "se_440hz_mono_44100", "root_note": "A4" },
    { "path": "test/wav/test_880hz_22050_stereo.wav", "name": "se_880hz_stereo_22050" },
    {
      "path": "test/wav/test_loop_smpl.wav",
      "name": "loop_from_smpl_chunk",
      "loop": "auto"
    }
  ]
}
