{
  "codec": "ymz280",
  "format": "pcm8",
  "sample_rate": 22050,
  "boundary": 256,
  "output_bin": "output/test_ymz280_pcm8.bin",
  "output_json": "output/test_ymz280_pcm8.json",
  "wav_files": [
    { "path": "test/wav/test_440hz_44100_mono.wav",   "name": "se_440hz_mono_44100" },
    { "path": "test/wav/test_880hz_22050_stereo.wav", "name": "se_880hz_stereo_22050" },
    "test/wav/test_1khz_48000_mono.wav"
  ]
}
