{
  "codec": "adpcm-b",
  "sample_rate": 16000,
  "boundary": 32,
  "output_bin": "output/test_boundary_32.bin",
  "output_json": "output/test_boundary_32.json",
  "wav_files": [
    { "path": "test/wav/test_440hz_44100_mono.wav", "name": "se_440hz" },
    { "path": "test/wav/test_880hz_22050_stereo.wav", "name": "se_880hz" }
  ]
}
